{
  "model_id": "step-3.5-flash",
  "name": "StepFun 3.5 Flash",
  "model_provider": "stepfun",
  "status": "active",
  "display_name": "StepFun 3.5 Flash",
  "description": "Step 3.5 Flash is an open-source reasoning model by StepFun with 196B total parameters (11B active) using Mixture of Experts. It features a 256K context window, deep reasoning, tool calling, and agentic capabilities, achieving 97.3 on AIME 2025 and 74.4% on SWE-bench Verified.",
  "context": {
    "window": 262114,
    "max_output_tokens": 262114
  },
  "modalities": {
    "input": [
      "text",
      "image"
    ],
    "output": [
      "text"
    ]
  },
  "capabilities": {
    "reasoning": true,
    "tool_use": true,
    "vision": true
  },
  "availability": {
    "api": true,
    "open_weights": true
  },
  "release_date": "2026-01-29",
  "sources": [
    {
      "type": "documentation",
      "url": "https://openrouter.ai/api/v1/models",
      "retrieved_at": "2026-09-27",
      "title": "OpenRouter public model list",
      "notes": "Provider model id, name, context window, modalities, capabilities and prices as published by an aggregator rather than by the model developer."
    },
    {
      "type": "documentation",
      "url": "https://ai-gateway.vercel.sh/v1/models",
      "retrieved_at": "2026-09-27",
      "title": "Vercel AI Gateway public model list",
      "notes": "Provider model id, name, release date, context window, modalities, capabilities and prices as published by an aggregator rather than by the model developer."
    }
  ],
  "updated_at": "2026-09-27"
}
