{
  "model_id": "fugu-ultra",
  "name": "Fugu Ultra",
  "model_provider": "sakana-ai",
  "status": "active",
  "display_name": "Fugu Ultra",
  "description": "Fugu Ultra coordinates a deeper pool of expert agents to maximize answer quality on hard, high-stakes problems. Fugu Ultra focuses on maximizing performance, for a higher cost. It routes between one to three agents, depending on the problem.",
  "context": {
    "window": 1000000,
    "max_output_tokens": 1000000
  },
  "modalities": {
    "input": [
      "text",
      "image"
    ],
    "output": [
      "text"
    ]
  },
  "capabilities": {
    "vision": true,
    "tool_use": true,
    "reasoning": true,
    "structured_output": true,
    "json_mode": true
  },
  "availability": {
    "api": true
  },
  "release_date": "2026-06-21",
  "sources": [
    {
      "type": "documentation",
      "url": "https://openrouter.ai/api/v1/models",
      "retrieved_at": "2026-09-27",
      "title": "OpenRouter public model list",
      "notes": "Provider model id, name, context window, modalities, capabilities and prices as published by an aggregator rather than by the model developer."
    },
    {
      "type": "documentation",
      "url": "https://ai-gateway.vercel.sh/v1/models",
      "retrieved_at": "2026-09-27",
      "title": "Vercel AI Gateway public model list",
      "notes": "Provider model id, name, release date, context window, modalities, capabilities and prices as published by an aggregator rather than by the model developer."
    }
  ],
  "updated_at": "2026-09-27"
}
