{
  "model_id": "gemini-3.1-flash-lite-preview",
  "name": "Gemini 3.1 Flash Lite Preview",
  "model_provider": "google",
  "status": "retired",
  "display_name": "Gemini 3.1 Flash Lite Preview",
  "context": {
    "window": 1048576,
    "max_output_tokens": 65536
  },
  "modalities": {
    "input": [
      "text",
      "image",
      "video",
      "file",
      "audio"
    ],
    "output": [
      "text"
    ]
  },
  "capabilities": {
    "reasoning": true,
    "json_mode": true,
    "structured_output": true,
    "tool_use": true
  },
  "availability": {
    "api": false
  },
  "sources": [
    {
      "type": "documentation",
      "url": "https://openrouter.ai/api/v1/models",
      "retrieved_at": "2026-09-27",
      "title": "OpenRouter public model list",
      "notes": "Provider model id, name, context window, modalities, capabilities and prices as published by an aggregator rather than by the model developer."
    },
    {
      "type": "official",
      "url": "https://ai.google.dev/gemini-api/docs/deprecations",
      "retrieved_at": "2026-10-01",
      "title": "Gemini deprecations",
      "notes": "Shut down May 25, 2026; recommended replacement is gemini-3.1-flash-lite."
    }
  ],
  "updated_at": "2026-10-01"
}
