{
  "model_id": "llama-3.3-70b-instruct",
  "name": "Llama 3.3 70B Instruct",
  "display_name": "Llama 3.3 70B Instruct",
  "model_provider": "meta",
  "family": "Llama",
  "version": null,
  "status": "active",
  "release_date": null,
  "updated_at": "2026-09-26",
  "description": "Meta's 70-billion parameter instruct model with a 128K context window; open weights released under the Llama 3.3 community license.",
  "context": {
    "window": 131072
  },
  "modalities": {
    "input": [
      "text"
    ],
    "output": [
      "text"
    ]
  },
  "capabilities": {
    "tool_use": true,
    "vision": false,
    "reasoning": false,
    "function_calling": true,
    "streaming": true
  },
  "availability": {
    "api": true,
    "cloud": true,
    "open_weights": true,
    "self_hostable": true
  },
  "sources": [
    {
      "type": "official",
      "url": "https://docs.aws.amazon.com/bedrock/latest/userguide/model-card-meta-llama-3-3-70b-instruct",
      "retrieved_at": "2026-09-26",
      "title": "Amazon Bedrock model card",
      "notes": "128K context window; Bedrock caps max output at 4K tokens, other providers publish different output limits, so no single model-level max output is recorded."
    },
    {
      "type": "official",
      "url": "https://huggingface.co/meta-llama/Llama-3.3-70B-Instruct",
      "retrieved_at": "2026-09-26",
      "title": "Open-weight release",
      "notes": "Weights and Llama 3.3 license on Hugging Face."
    },
    {
      "type": "official",
      "url": "https://console.groq.com/docs/models",
      "retrieved_at": "2026-09-26",
      "title": "Groq supported models",
      "notes": "131,072 context window and 32,768 max completion tokens for llama-3.3-70b-versatile."
    },
    {
      "type": "community",
      "url": "https://openrouter.ai/api/v1/models",
      "retrieved_at": "2026-09-26",
      "title": "OpenRouter model list",
      "notes": "Context window for id meta-llama/llama-3.3-70b-instruct cross-checked against OpenRouter's public model list."
    }
  ]
}
