{
  "model_id": "glm-5.3-prime",
  "name": "GLM 5.3 Prime",
  "model_provider": "zai",
  "status": "active",
  "display_name": "GLM 5.3 Prime",
  "context": {
    "window": 1000000,
    "max_output_tokens": 131072
  },
  "modalities": {
    "input": [
      "text"
    ],
    "output": [
      "text"
    ]
  },
  "capabilities": {
    "reasoning": true,
    "json_mode": true,
    "tool_use": true
  },
  "availability": {
    "api": true
  },
  "sources": [
    {
      "type": "documentation",
      "url": "https://openrouter.ai/api/v1/models",
      "retrieved_at": "2026-09-27",
      "title": "OpenRouter public model list",
      "notes": "Provider model id, name, context window, modalities, capabilities and prices as published by an aggregator rather than by the model developer."
    }
  ],
  "updated_at": "2026-09-27"
}
