{
  "model_id": "mercury-2",
  "name": "Mercury 2",
  "model_provider": "inception-labs",
  "status": "active",
  "display_name": "Mercury 2",
  "description": "A diffusion-based reasoning LLM that generates text via parallel refinement (not token-by-token), delivering real-time latency with ~1k tokens/sec plus 128K context and built-in tool/JSON support.",
  "context": {
    "window": 128000,
    "max_output_tokens": 128000
  },
  "modalities": {
    "input": [
      "text"
    ],
    "output": [
      "text"
    ]
  },
  "capabilities": {
    "reasoning": true,
    "tool_use": true,
    "structured_output": true,
    "json_mode": true
  },
  "availability": {
    "api": true
  },
  "release_date": "2026-02-24",
  "sources": [
    {
      "type": "documentation",
      "url": "https://openrouter.ai/api/v1/models",
      "retrieved_at": "2026-09-27",
      "title": "OpenRouter public model list",
      "notes": "Provider model id, name, context window, modalities, capabilities and prices as published by an aggregator rather than by the model developer."
    },
    {
      "type": "documentation",
      "url": "https://ai-gateway.vercel.sh/v1/models",
      "retrieved_at": "2026-09-27",
      "title": "Vercel AI Gateway public model list",
      "notes": "Provider model id, name, release date, context window, modalities, capabilities and prices as published by an aggregator rather than by the model developer."
    }
  ],
  "updated_at": "2026-09-27"
}
