{
  "model_id": "seed-1.6",
  "name": "Seed 1.6",
  "model_provider": "bytedance",
  "status": "active",
  "display_name": "Seed 1.6",
  "description": "ByteDance's new multimodal deep-thinking model, supporting both text and visual inputs with enhanced reasoning capabilities.",
  "context": {
    "window": 256000,
    "max_output_tokens": 32000
  },
  "modalities": {
    "input": [
      "text",
      "image"
    ],
    "output": [
      "text"
    ]
  },
  "capabilities": {
    "reasoning": true,
    "tool_use": true,
    "vision": true
  },
  "availability": {
    "api": true
  },
  "release_date": "2025-09-01",
  "sources": [
    {
      "type": "documentation",
      "url": "https://openrouter.ai/api/v1/models",
      "retrieved_at": "2026-09-27",
      "title": "OpenRouter public model list",
      "notes": "Provider model id, name, context window, modalities, capabilities and prices as published by an aggregator rather than by the model developer."
    },
    {
      "type": "documentation",
      "url": "https://ai-gateway.vercel.sh/v1/models",
      "retrieved_at": "2026-09-27",
      "title": "Vercel AI Gateway public model list",
      "notes": "Provider model id, name, release date, context window, modalities, capabilities and prices as published by an aggregator rather than by the model developer."
    }
  ],
  "updated_at": "2026-09-27"
}
