{
  "model_id": "wan-v3.0-video",
  "name": "Wan v3.0 Video",
  "model_provider": "qwen",
  "status": "active",
  "display_name": "Wan v3.0 Video",
  "description": "All-in-one video generation model supporting text-to-video, image-to-video, first/last-frame, and omni-modal reference-based generation (image, video, and audio references) with synchronized audio, at up to 30 seconds per clip.",
  "modalities": {
    "input": [
      "text",
      "audio",
      "image",
      "video"
    ],
    "output": [
      "video"
    ]
  },
  "capabilities": {
    "vision": true
  },
  "availability": {
    "api": true
  },
  "release_date": "2026-08-23",
  "sources": [
    {
      "type": "documentation",
      "url": "https://ai-gateway.vercel.sh/v1/models",
      "retrieved_at": "2026-09-27",
      "title": "Vercel AI Gateway public model list",
      "notes": "Provider model id, name, release date, context window, modalities, capabilities and prices as published by an aggregator rather than by the model developer."
    }
  ],
  "updated_at": "2026-09-27"
}
