{
  "model_id": "gpt-6-sol-fast",
  "name": "GPT-6 Sol (Fast)",
  "model_provider": "openai",
  "status": "active",
  "display_name": "GPT-6 Sol (Fast)",
  "description": "GPT-6 Sol is OpenAI's reasoning model for complex coding and agentic workflows. It accepts text and images, generates text, and supports a 1,050,000-token context window with up to 128,000 output tokens. Configurable reasoning effort, structured outputs, prompt caching, and Responses API tools make it suited to software development and multi-step automation.",
  "context": {
    "window": 1050000,
    "max_output_tokens": 128000
  },
  "modalities": {
    "input": [
      "text",
      "image",
      "file"
    ],
    "output": [
      "text"
    ]
  },
  "capabilities": {
    "reasoning": true,
    "structured_output": true,
    "tool_use": true,
    "vision": true,
    "json_mode": true
  },
  "availability": {
    "api": true
  },
  "release_date": "2026-09-22",
  "sources": [
    {
      "type": "documentation",
      "url": "https://ai-gateway.vercel.sh/v1/models",
      "retrieved_at": "2026-09-27",
      "title": "Vercel AI Gateway public model list",
      "notes": "Provider model id, name, release date, context window, modalities, capabilities and prices as published by an aggregator rather than by the model developer."
    }
  ],
  "updated_at": "2026-09-27"
}
