{
  "model_id": "o4-mini-fast",
  "name": "o4-mini (Fast)",
  "model_provider": "openai",
  "status": "active",
  "display_name": "o4-mini (Fast)",
  "description": "OpenAI's o4-mini delivers fast, cost-efficient reasoning with exceptional performance for its size, particularly excelling in math (best-performing on AIME benchmarks), coding, and visual tasks.",
  "context": {
    "window": 200000,
    "max_output_tokens": 100000
  },
  "modalities": {
    "input": [
      "text",
      "image",
      "file"
    ],
    "output": [
      "text"
    ]
  },
  "capabilities": {
    "reasoning": true,
    "tool_use": true,
    "vision": true,
    "structured_output": true,
    "json_mode": true
  },
  "availability": {
    "api": true
  },
  "release_date": "2025-04-16",
  "sources": [
    {
      "type": "documentation",
      "url": "https://ai-gateway.vercel.sh/v1/models",
      "retrieved_at": "2026-09-27",
      "title": "Vercel AI Gateway public model list",
      "notes": "Provider model id, name, release date, context window, modalities, capabilities and prices as published by an aggregator rather than by the model developer."
    }
  ],
  "updated_at": "2026-09-27"
}
