{
  "model_id": "qwen3-vl-thinking",
  "name": "Qwen3 VL 235B A22B Thinking",
  "model_provider": "qwen",
  "status": "active",
  "display_name": "Qwen3 VL 235B A22B Thinking",
  "description": "Qwen3 series VL models feature significantly enhanced multimodal reasoning capabilities, with a particular focus on optimizing the model for STEM and mathematical reasoning. Visual perception and recognition abilities have been comprehensively improved, and OCR capabilities have undergone a major upgrade.",
  "context": {
    "window": 131072,
    "max_output_tokens": 32768
  },
  "modalities": {
    "input": [
      "text",
      "image",
      "file"
    ],
    "output": [
      "text"
    ]
  },
  "capabilities": {
    "vision": true,
    "reasoning": true,
    "tool_use": true
  },
  "availability": {
    "api": true
  },
  "release_date": "2025-09-23",
  "sources": [
    {
      "type": "documentation",
      "url": "https://ai-gateway.vercel.sh/v1/models",
      "retrieved_at": "2026-09-27",
      "title": "Vercel AI Gateway public model list",
      "notes": "Provider model id, name, release date, context window, modalities, capabilities and prices as published by an aggregator rather than by the model developer."
    }
  ],
  "updated_at": "2026-09-27"
}
