{
  "model_id": "seedream-5.0-lite",
  "name": "Seedream 5.0 Lite",
  "model_provider": "bytedance",
  "status": "active",
  "display_name": "Seedream 5.0 Lite",
  "description": "ByteDance-Seedream-5.0-lite is the latest image generation model released by BytePlus. For the first time, it introduces web-connected retrieval, enabling the model to fuse real-time online information to significantly improve the timeliness and relevance of generated images. The model’s reasoning and comprehension capabilities are further upgraded, allowing it to accurately interpret complex prompts and visual inputs. In addition, ByteDance-Seedream-5.0-lite delivers notable improvements in global knowledge coverage, reference consistency, and professional-grade scene generation, making it well suited for enterprise-level visual creation workflows.",
  "modalities": {
    "input": [
      "text"
    ],
    "output": [
      "image"
    ]
  },
  "availability": {
    "api": true
  },
  "release_date": "2026-02-13",
  "sources": [
    {
      "type": "documentation",
      "url": "https://ai-gateway.vercel.sh/v1/models",
      "retrieved_at": "2026-09-27",
      "title": "Vercel AI Gateway public model list",
      "notes": "Provider model id, name, release date, context window, modalities, capabilities and prices as published by an aggregator rather than by the model developer."
    }
  ],
  "updated_at": "2026-09-27"
}
