{
  "model_id": "claude-opus-4.8-fast",
  "name": "Claude Opus 4.8 (Fast)",
  "model_provider": "anthropic",
  "status": "active",
  "display_name": "Claude Opus 4.8 (Fast)",
  "description": "Opus 4.8 is a focused upgrade to Opus 4.7 and is Anthropic's best generally available model for coding, agentic tasks, and enterprise workflows. It builds on the strengths of previous Opus models with stronger performance on complex, multi-step coding tasks. Anthropic recommends using it on long-horizon coding and agentic tasks. It is also stronger on professional work, including document drafting, data analysis, and presentations.",
  "context": {
    "window": 1000000,
    "max_output_tokens": 128000
  },
  "modalities": {
    "input": [
      "text",
      "image",
      "file"
    ],
    "output": [
      "text"
    ]
  },
  "capabilities": {
    "tool_use": true,
    "reasoning": true,
    "vision": true,
    "structured_output": true,
    "json_mode": true
  },
  "availability": {
    "api": true
  },
  "release_date": "2026-05-28",
  "sources": [
    {
      "type": "documentation",
      "url": "https://ai-gateway.vercel.sh/v1/models",
      "retrieved_at": "2026-09-27",
      "title": "Vercel AI Gateway public model list",
      "notes": "Provider model id, name, release date, context window, modalities, capabilities and prices as published by an aggregator rather than by the model developer."
    }
  ],
  "updated_at": "2026-09-27"
}
