{
  "model_id": "voyage-code-2",
  "name": "Voyage Code 2",
  "model_provider": "voyage",
  "status": "active",
  "display_name": "Voyage Code 2",
  "description": "Voyage AI's embedding model optimized for code retrieval (17% better than alternatives). This is the previous generation of code embeddings models.",
  "modalities": {
    "input": [
      "text"
    ],
    "output": [
      "text"
    ]
  },
  "availability": {
    "api": true
  },
  "release_date": "2024-01-01",
  "sources": [
    {
      "type": "documentation",
      "url": "https://ai-gateway.vercel.sh/v1/models",
      "retrieved_at": "2026-09-27",
      "title": "Vercel AI Gateway public model list",
      "notes": "Provider model id, name, release date, context window, modalities, capabilities and prices as published by an aggregator rather than by the model developer."
    }
  ],
  "updated_at": "2026-09-27"
}
