{
  "model_id": "gpt-5.1-thinking",
  "name": "GPT 5.1 Thinking",
  "model_provider": "openai",
  "status": "active",
  "display_name": "GPT 5.1 Thinking",
  "description": "An upgraded version of GPT-5 that adapts thinking time more precisely to the question to spend more time on complex questions and respond more quickly to simpler tasks.",
  "context": {
    "window": 400000,
    "max_output_tokens": 128000
  },
  "modalities": {
    "input": [
      "text",
      "image",
      "file"
    ],
    "output": [
      "text"
    ]
  },
  "capabilities": {
    "reasoning": true,
    "tool_use": true,
    "vision": true,
    "structured_output": true,
    "json_mode": true
  },
  "availability": {
    "api": true
  },
  "release_date": "2025-11-12",
  "sources": [
    {
      "type": "documentation",
      "url": "https://ai-gateway.vercel.sh/v1/models",
      "retrieved_at": "2026-09-27",
      "title": "Vercel AI Gateway public model list",
      "notes": "Provider model id, name, release date, context window, modalities, capabilities and prices as published by an aggregator rather than by the model developer."
    }
  ],
  "updated_at": "2026-09-27"
}
